Kiana Zboncak,Consequatur nostrum beatae maiores minima temporibus similique impedit et doloremque.,-136.7014406982376,-169.91703020139084,2020-12-05T21:36:29.977733824Z,91,5
Shany Graham,Omnis architecto adipisci est veniam minima rerum voluptatem ut expedita.,-178.35635247274925,-114.58164829303807,2020-12-05T14:52:14.735905805Z,49,2
Geraldine Grant,Quibusdam eum alias vitae ex consequatur amet enim non sit.,75.00449539103911,-121.16224683428652,2020-12-05T13:40:27.710013457Z,70,30
Malvina Langosh,Eaque exercitationem maiores in commodi et incidunt debitis atque possimus.,-78.49163424039519,-113.15243411731876,2020-12-06T07:33:18.591765886Z,4,4
Valentin Rohan,Quam officia et expedita et omnis ad sed sunt quia.,73.32996072383773,-96.1263376821717,2020-12-06T07:12:13.430120068Z,21,27
Elza Farrell,Et sed nisi accusamus ut quae distinctio eum aut fugiat.,-106.30760196350617,72.03206729862632,2020-12-05T15:49:32.706495488Z,26,15
Mara Bernier,Autem soluta voluptatem voluptates qui excepturi consequatur tempore expedita reiciendis.,96.73233212899993,154.49489356470798,2020-12-05T16:57:37.94418892Z,76,13
Chris Gislason,In eum incidunt impedit ex deserunt aut hic placeat vitae.,-34.03048196046129,-39.83156034220781,2020-12-05T19:20:04.264254329Z,55,5
Bella Koch,Itaque eos enim voluptatem doloremque quod nostrum provident sunt eos.,-52.03196614614228,-64.61537427444034,2020-12-06T05:42:08.478535481Z,19,24
Nedra Veum,Soluta rem et magni fugit deleniti ut et labore corrupti.,22.555572266547387,-18.677163552112404,2020-12-06T01:50:19.380483089Z,36,13
Walton Ferry,Commodi eius est eos qui fuga vero aspernatur sed enim.,40.71338349779981,-97.65886854636774,2020-12-06T08:41:21.88209855Z,25,5
Berenice Connelly,Ratione et dolor cupiditate delectus suscipit excepturi repellat vero et.,-147.38320199472548,-70.19416898925243,2020-12-06T04:59:06.497010617Z,60,34
Nathaniel Romaguera,Qui ipsa qui dolorum est ipsum reprehenderit qui consequatur architecto.,39.227395385766755,123.39064187903767,2020-12-06T04:08:34.171759591Z,8,2
Jack Fahey,Velit ipsum eum eum ratione harum libero et deserunt enim.,64.60567890701248,57.29412314769408,2020-12-06T13:02:33.577013282Z,6,4
Patrick Ullrich,Sunt doloremque et dolorem accusantium culpa et quae laboriosam accusantium.,120.46125067455716,-111.7963145425155,2020-12-05T14:54:36.777963494Z,81,37
Frederik Rowe,Quaerat quis molestias quia soluta qui ut et sed deserunt.,-67.79943053713012,148.85643179143193,2020-12-06T09:12:42.697310491Z,27,21
Addison Hodkiewicz,Tenetur pariatur voluptas et cumque labore quam dolor enim cum.,153.43774522040633,6.292499303820392,2020-12-06T09:58:22.432738968Z,32,19
Elwin Spinka,Consequatur excepturi dolor eum nulla magni optio velit laudantium vel.,123.22238200140674,17.45200967645826,2020-12-06T00:04:54.437193445Z,6,23
Jessyca Block,Autem fuga blanditiis tempora eum quaerat voluptatibus nemo sequi illo.,125.8389104949195,-127.21538239659219,2020-12-06T09:31:14.10807808Z,43,15
Jordyn Gulgowski,Non nostrum recusandae corrupti fugit accusamus nam qui voluptas molestiae.,-41.94774336558956,-166.84338337800614,2020-12-06T07:16:37.612663642Z,42,5
Sven Hoppe,Iure quia et hic natus repellendus id accusantium dolor officiis.,-65.4987827409376,20.49291962642863,2020-12-05T13:47:12.74990558Z,84,28
Andy Spinka,Eligendi aut sapiente sed quo maiores similique sed inventore possimus.,176.87830154991155,-56.41664511349269,2020-12-06T07:17:15.661300591Z,63,7
Winnifred Gaylord,Reprehenderit et omnis doloribus explicabo vel ut illum nostrum minus.,166.19949954228366,-85.17093273019141,2020-12-06T00:01:15.504497764Z,15,36
Ronaldo Vandervort,Neque voluptas sed accusamus ipsa qui placeat aliquid porro eveniet.,128.63487921452366,-35.41465269929219,2020-12-06T08:05:45.792371496Z,60,0
Kevin Krajcik,Repellat ut ab quas mollitia esse aliquid reprehenderit laboriosam quia.,41.57520954750311,-176.42832711209616,2020-12-05T21:25:31.038165082Z,61,29
Delta Kiehn,Dignissimos eos saepe architecto consectetur velit vel libero commodi unde.,-23.29200164059978,64.764282735649,2020-12-05T18:43:27.636638731Z,47,18
Kali Wilkinson,Dignissimos maxime cumque molestiae voluptate accusamus rerum maiores eaque corporis.,-24.495263385524538,11.628294187511983,2020-12-06T04:04:00.558527596Z,100,1
Bulah Fay,Vel incidunt cupiditate cumque omnis et repellat repellat rerum fugiat.,-167.62144404947952,-70.63517512345743,2020-12-06T07:49:08.46248954Z,78,32
Hailee Gislason,Iusto porro quo et voluptatibus exercitationem placeat aut ea error.,87.39366700613454,30.05815144764199,2020-12-06T04:22:30.280175421Z,18,16
Jonathon Bogisich,Temporibus consectetur deleniti rerum iste voluptatem quas corrupti corporis vitae.,-78.68140930694194,-57.95843851822012,2020-12-05T15:14:39.541093044Z,22,37
Eliseo Wyman,Doloribus et libero et enim cum et hic sed assumenda.,93.34860640675697,-8.423810751224408,2020-12-05T21:02:56.678181686Z,28,30
Maverick Gottlieb,Quis veritatis dolorum voluptatibus velit sunt enim quia quos dolorem.,-57.8764708661994,149.6600874089778,2020-12-05T21:24:18.5249752Z,36,23
Troy Bernier,Sunt adipisci id quaerat sit illum et sint in delectus.,-147.00671177699712,-78.58082454948459,2020-12-06T10:13:32.318110386Z,24,33
Levi Powlowski,Ea quisquam accusantium accusamus porro et consequatur praesentium eum unde.,-129.8395223513363,-100.68995006684726,2020-12-06T01:21:54.537431557Z,55,13
Pedro Miller,Rem ex officiis unde eaque velit nesciunt vel tenetur quia.,-10.294444463072466,-73.37940853478622,2020-12-05T22:15:32.203251688Z,31,1
Lou Conn,Iste recusandae inventore velit consequuntur odit fugit fugiat nihil sint.,-10.936001739869283,-47.28982450627689,2020-12-06T11:56:06.947209319Z,8,40
Jeremy Tremblay,Necessitatibus non in et nemo repellat voluptates et et molestiae.,-11.485863131535808,73.49731910985483,2020-12-05T15:12:55.799156813Z,86,0
Leila Hansen,Voluptas impedit enim expedita labore recusandae est omnis molestiae quod.,-69.32014264423499,94.19268638480844,2020-12-06T06:10:07.071314408Z,95,1
Josiane Watsica,Ad praesentium dicta ipsa in minima qui sit eius consequatur.,-93.36942357285868,3.5911210060429823,2020-12-06T03:53:05.770114398Z,40,14
Alfonzo Rempel,Necessitatibus doloremque sint aut sequi non reprehenderit debitis cupiditate ut.,-30.649682422978373,-48.103884461658794,2020-12-05T21:08:01.580292794Z,50,15
Meda Ritchie,Recusandae animi inventore qui dolore est consequatur laborum ipsa qui.,-59.21175655091103,-155.19647478437747,2020-12-06T11:44:15.110024102Z,6,20
Terrill Kuphal,Excepturi vitae atque natus fugit veniam perferendis vel doloremque pariatur.,-37.763154831490056,40.947151992329,2020-12-05T14:02:37.932504544Z,21,17
Susan Feest,Dolorem excepturi sint vel fugiat saepe quo sit reiciendis molestiae.,-100.0669689225228,-103.22383218285276,2020-12-06T08:33:07.341266403Z,6,36
Nathen Fritsch,Et sapiente id quos sunt neque consequatur doloribus nesciunt id.,-22.741202885248697,88.43595626851982,2020-12-05T20:00:45.847306977Z,74,17
Kacie Gutmann,Neque aut deserunt repudiandae et minima iste quis ut tenetur.,-34.52688799782479,-155.01614286290277,2020-12-06T02:17:46.008043029Z,56,39
Hanna Bosco,Corrupti eligendi ipsa sapiente rerum consectetur fugit est et labore.,-5.128398211785594,46.61816730926421,2020-12-05T13:37:04.91864588Z,73,2
Verda Tremblay,Veniam tempora quibusdam vel magnam et quasi ea reiciendis molestiae.,-63.0713704914086,161.43179738392956,2020-12-06T01:40:35.021815671Z,35,28
Adelbert Cole,Omnis nihil delectus odio magnam maxime neque et blanditiis qui.,76.1180382691814,121.00054687704932,2020-12-05T22:45:12.076035171Z,57,11
Paris Beer,Accusamus fugiat veniam dolores aut est cum vero quidem facilis.,-160.818637470423,-162.5996468677948,2020-12-06T10:03:13.257261491Z,93,38
Margarete Herman,Autem hic suscipit sapiente explicabo et ab dolor eius ea.,-18.744285768845913,121.20353361849163,2020-12-05T15:33:19.408443739Z,11,10
Penelope Senger,Et dolorum laboriosam voluptatem aut est nobis quas et magnam.,151.51758665658474,-91.47412318634302,2020-12-06T11:52:46.828762907Z,90,31
Mitchel Torp,Iste quis ut aut provident unde quis voluptas amet eveniet.,-1.6659314421738713,-12.054260999480164,2020-12-05T18:29:41.906560134Z,35,36
Ursula Hickle,Saepe tempore beatae cum aliquid dolores sunt vel autem assumenda.,41.1052477364272,-165.2937147512007,2020-12-06T00:22:22.948569177Z,95,10
Elna Schroeder,Vitae veniam sit cum impedit provident omnis ad voluptatem quae.,65.63964465870578,-142.32566648245114,2020-12-06T12:47:28.440077744Z,17,38
Layla Thompson,Ut quo voluptatum natus amet consequatur natus sunt aut minus.,80.3824397142526,153.30935933426633,2020-12-05T18:13:27.744001851Z,24,24
Dawn Ernser,Rem recusandae dolorem similique animi ullam eveniet est adipisci esse.,-72.07483578891069,132.56452643387195,2020-12-06T11:47:49.138612884Z,41,12
Trever Little,Est similique ullam aut nostrum laudantium sit ullam corrupti ratione.,-151.58591709580293,-138.9736824797591,2020-12-06T00:14:36.301254589Z,55,14
Hans Gottlieb,Unde eius sit ipsam doloremque dolores cupiditate necessitatibus qui ea.,155.3843410353798,52.43533489839939,2020-12-06T05:18:19.45746552Z,96,39
Althea Deckow,Quasi quis nam non et error dolores commodi inventore quos.,-138.56312727558236,-46.69931935866984,2020-12-06T12:18:28.231858035Z,19,21
Ila Jakubowski,Maxime quos assumenda repudiandae enim alias quam sunt neque quia.,0.30157104239165733,-50.271748366518096,2020-12-05T14:37:10.258634169Z,47,9
Katelynn Ritchie,Distinctio voluptatum qui unde quia exercitationem voluptas ut soluta dolores.,-27.366762839456356,159.01968756375942,2020-12-05T15:41:57.440211566Z,65,37
Joy Homenick,Velit et magni vel est sit ipsam sed debitis officiis.,77.31413204619611,-105.3134398017791,2020-12-06T12:40:05.489100244Z,48,34
Mustafa Casper,Soluta libero facere aut aspernatur explicabo dolorem maiores qui sit.,-89.77995199127385,-3.8398468948083178,2020-12-06T00:44:06.92759502Z,56,2
Dasia Bode,Laboriosam aut est voluptatibus neque recusandae in voluptates amet perspiciatis.,119.23867324367876,2.979051517882084,2020-12-05T16:54:23.01108988Z,17,23
Queenie Steuber,Dolore cupiditate aut earum occaecati quia voluptatem dolorem tempora veniam.,-161.79824916056788,-19.51904584022253,2020-12-06T00:14:49.162591959Z,29,27
Dayna Rempel,Doloribus vel natus vel autem nemo in sint quidem qui.,40.2624878885172,7.010600291770373,2020-12-06T13:12:51.461494069Z,0,14
Mae Graham,Accusamus earum et fuga vel incidunt molestiae ea dolorum at.,-156.4603000110078,133.40669144503175,2020-12-06T02:43:11.04568494Z,19,35
Keegan Jenkins,Illum tempora eligendi quia veniam voluptas voluptas veritatis laborum possimus.,-27.875880679886222,-168.05227106405798,2020-12-06T13:16:01.629626998Z,31,33
Taryn Flatley,Nobis pariatur quas odio et voluptas eligendi sapiente dolorem voluptatem.,70.98475356930405,-74.42092641488456,2020-12-06T03:52:50.343016079Z,14,15
Ramiro Terry,Molestiae et quo pariatur voluptatem totam ducimus dolores omnis et.,98.49431399560501,125.66795356325974,2020-12-05T13:57:25.988857921Z,61,29
Geoffrey Nolan,Necessitatibus qui dolor in neque laborum qui eligendi fugiat qui.,176.18049258365835,50.175589729746974,2020-12-06T07:40:50.568769945Z,20,2
Leone Stiedemann,Est quisquam nihil voluptatem magni quod doloremque a ea laudantium.,-45.06422303628142,-133.78358296275783,2020-12-06T04:06:57.796527628Z,89,39
Ethelyn Schultz,Ut recusandae et autem porro magnam qui cupiditate beatae excepturi.,-116.35383517193968,-62.169326710928104,2020-12-06T07:43:21.622375363Z,46,18
Ryleigh Jacobson,Harum ut qui aut alias dolor autem quo sapiente dolor.,-25.28980126983538,114.66576738638389,2020-12-05T13:55:39.442426061Z,86,30
Britney Stamm,Quis voluptates cumque qui non natus dolores accusamus id animi.,-100.22508321018668,70.62714467193115,2020-12-05T19:38:01.76184606Z,23,6
Jairo Gusikowski,Totam quia ducimus et qui aut dolores laboriosam unde enim.,126.49215042736313,-78.27447826876039,2020-12-05T17:04:44.560503534Z,94,4
Jennifer Roob,Qui consequatur architecto suscipit fuga nisi ut reprehenderit voluptate aut.,-34.20283050074909,-3.525828667898139,2020-12-05T14:26:52.09347275Z,8,20
Major Rutherford,Voluptas dolor sit quod est quibusdam sint itaque voluptatum ducimus.,-120.61602592301986,-58.106305700281524,2020-12-06T00:09:37.929356605Z,40,2
Clifford Runolfsson,Cum voluptatem et dignissimos animi et rem non occaecati pariatur.,-136.43897328304203,157.4652317053039,2020-12-05T18:49:10.553240496Z,52,17
Clarissa Considine,Quia tenetur itaque explicabo repudiandae quo suscipit et et voluptatem.,108.19726873996058,37.55523392782817,2020-12-05T22:24:57.985370123Z,56,11
Alexandra Schaden,Dolor possimus quidem magnam dicta et ipsa molestias vero consequatur.,147.8991301480189,163.63349896434107,2020-12-05T13:54:55.973112783Z,11,31
Casper Boyer,Dignissimos neque voluptates fugiat magnam voluptas in qui eum adipisci.,-85.17816949765782,80.22190320738935,2020-12-05T14:31:40.942290157Z,21,4
Emmet Hickle,Temporibus nulla aut quidem autem cupiditate saepe sunt adipisci harum.,25.54715214074278,4.183488033622382,2020-12-06T10:46:11.606019229Z,94,15
Braulio Pouros,Qui laudantium eaque laudantium voluptatem non sunt velit rerum et.,3.034488849752165,26.721400538003877,2020-12-05T20:14:48.62959231Z,70,5
Tillman Schamberger,Neque eos rerum amet fugiat nam velit ipsa quidem nostrum.,-27.7444456153045,124.71016040216722,2020-12-05T23:48:41.831745947Z,92,20
Celia Brown,Quis quidem quos rem earum velit id officia mollitia a.,157.7494344821174,-136.89503680267924,2020-12-05T20:03:17.418661642Z,56,26
Thelma Huels,Recusandae enim aut autem excepturi accusantium et voluptatibus tenetur nihil.,25.12464683744892,-97.1929649662041,2020-12-06T07:47:57.692278342Z,45,36
Velva DuBuque,Corrupti aut aut placeat nulla sint consequatur consequuntur culpa alias.,-33.3946932063796,-104.09250202677535,2020-12-05T15:25:44.330663877Z,9,19
Deja Mills,Suscipit omnis quae sint est quaerat et culpa dolorem eum.,116.28555954470909,-113.11628226527091,2020-12-05T20:53:21.641608211Z,92,9
Tania Welch,Quo deleniti harum quasi est dolore magnam atque ea facilis.,98.01015378879026,-109.82067322560398,2020-12-06T05:37:57.614378167Z,55,36
Dulce Hahn,Mollitia cumque illum qui laboriosam et omnis quo assumenda sint.,80.89579124314685,23.37963233171672,2020-12-05T17:59:17.147389806Z,43,37
Carmela Moore,Sed totam quod odit et vero aut rerum dolores at.,99.2555764843944,54.829716521580906,2020-12-06T13:16:45.757193038Z,80,8
Baylee Sporer,Minima in iure sapiente voluptatum deleniti voluptatem ex iure amet.,127.48129295151648,-119.21800314707113,2020-12-05T18:29:15.058433956Z,54,2
Hope Zulauf,Repudiandae consequatur maiores quos error sint voluptatibus aut molestias est.,-41.92345406321613,174.6069070586068,2020-12-05T22:17:31.996925822Z,80,11
Kara Hartmann,Itaque beatae doloribus officiis aut aut magnam omnis ut rerum.,-164.76262147327964,-43.30404123048015,2020-12-06T09:50:27.161251902Z,51,19
Tianna Runolfsson,Et et nostrum nulla maxime labore unde velit et voluptas.,156.3353084016785,-151.92979195735316,2020-12-05T15:04:43.339146691Z,63,33
Kenyon Hagenes,Officiis mollitia non earum autem ut quam reiciendis illum magni.,41.54321477056044,-117.59930954589004,2020-12-06T01:30:30.783600584Z,81,16
Karine Pfannerstill,Sint nobis laboriosam illo molestias omnis autem commodi molestiae vel.,-60.944271870641515,-79.56813644182463,2020-12-06T09:42:07.765692945Z,98,4
Randi Metz,Rerum quia consequatur nesciunt at sit aspernatur fugit unde rem.,171.1806875851169,-71.58441835111536,2020-12-06T04:38:59.546363479Z,46,40
Antonietta Volkman,Eos aut quia repudiandae facere vel et ut dolorum omnis.,-57.307411245839674,-31.822258184576498,2020-12-06T01:06:53.574120232Z,10,15
